rating,sentences
0,진짜 지금이라도 민족반역자 새끼들 잡아다 재산몰수하고 단두대에서 모가지 날려버려야된다
0,약물이나 승부조작에 대한건 없나?
0,리플달 가치조차없다 진심
0,나중에 어쩔수 없었다 하고 떠들놈들도 기억 합시다..
0, 열등감 대폭발!!!!!
0,감독이랑 선수들 세워놓고 한명씩 명존쎄 해도 분이 안풀릴거 같아
0, 구역질난다.
0, 당장 대통령직 정지 시키지.
0,진짜 친박인지 뭔박인지 두개골 터져서 우동사리가 튀어나올때까지 대가리 벽돌로 찍어버리고 싶다
0, 외교부장관에 대놓고 일본종놈 윤병세.
0,김정은 뇌를 조준하라
0,김기춘화장해라.
0,무조건 걸러야겠네...
0, 내거 믿는 진실은 결국은 거짓선동인가?
0,확실한 증거도 있는데 왜 긴급체포 안하냐
0,기내에서 난동은 무조건 구속 해야함
0,엿같은 나라 경제봐라 나라 망조길이다 ~
0,욕을 안할래야 안할수가없다
0, 우리는 상상도 못하는 국정운영을 하였으니
0,박근혜가 예수임을 입증하려면 저 십자가에 박근혜 매단 후에 3일 후에 부활하는 거 보자고 먼저 나와야 정상 아니냐?
0,판매 영원히 금지해라
0,나바로가 약빤것도 아니고 주작한것도 아닌데 왜 인성 운운 하시는지 ????
0,우린 우선 부패10위권안에서 벗어나자
0,균열이 여러개 벌어져서 흔들거릴 지경이 될 때까지 뭐했냐?
0, 좌파언론들 원하는대로 박 대통령은 국민 신임 못받는다 여겨지면 하야발표 할겁니다.
0,알굴 찍어서 뒷조사 한번해봐라
0, 선심쓰는 척 하기는ㅉㅉ
0,요즘이 어느시댄데 언론으로 국민들 눈과 귀를 속이려고하냐..
0,자끄 내글들을 지우는데 야 !!!!
0, 그리고 TV광고하게 냅두는 방통위는 뭐냐대체??
0,겨우 7년 미치겠다
0, 아 개빡쳐!!!!!!!!!
0,또라이가 따로없다
0,병신가튼 닥뇬 보내버리려면 정유라뇬 잡아와야한다는건가...
0,진짜 아구창 한대 쎄게 날리고싶다
0,배우는 바람펴도되냐?
0,일본노모시키들 죽여야
0, 똑같은 녀언놈들아!
0,입을 쳐 잡아 찢어 놓고 싶네.....
0,ㅡㅡ꺼져라 뭘 잘했다고 활동이냐
0,국민여러분 국민의 이름으로 조의연판사 탄핵소추를 100만서명받아서 국회에 제출합시다
0,초등학생을 대통령 시켜도 이거 보단 잘하겠다.
0,봐주니까사기치고사람죽이고
0,너도 바다에 똑같이 쳐넣어버리고싶다 .
0,병신새키ㅣ들 간만에 더운거라도 맞히니 좋냐
0,진짜횃불을 들어야 저 닥년이 상황을 인식할까??
0," 의미 : 3·1 만세운동은 불법이고, 일본의 한국 지배는 정당하다."
0, 아주 혐치는 커녕 파렴치 하구나.
0,그짤린사람들덕에 나머지 모두가 실업자인건생각안하나
0, mb처럼 굴복하면 이땅의 민주주의는 다시는 없다.
0,으휴 ... 이런것들한테 내세금이 월급으로 나간다니...ㅂ 쉬ㄴ 들.
0, 좌파언론의 선동질에 나라 무너진다
0,박근혜 2년 탄핵 무산되면 화염병에 불붙여 청와대을 불바다로 만들라.
0,설치 하려했던 시민단체 사무실에나 설치해라 ㆍ
0,썩어빠진 무능한 검찰보다 백배천배 낫다!!!!
0,이 썩을것들아..
0,저 연을 죽일순 없을까
0,이 부분 추후라도꼭 진실이 밝혀져야합니다.
0, 하루라도 빨리 돼지 똥별들을 국가보안법 위반 혐의로 잡아넣어야 이나라의 국방이 바로선다.
0, 얘들아 적당히해
0,세월호의 진실을 위해서는 삼성전자를 중국에 팔아서라도 밝혀라
0,손석희 저색끠 단한번도 중립적위치에서 방송한 꼬라지를못봄.
0,찌라시 언론에 통해 누명씌우고 아무 죄없는 청렴한 대통령에 야당은 끝까지 총을겨누는구나
0,10년 전부터 그림 표시하라고 했던걸 흡연율 떨어질 까봐...
0, 아무리그래도 애가아직어린데 거기가서 그짓하고싶냐?
0,모르쇠 저런것들은 주리를 틀어야돼
0, 그러니 광신적으로 빨아재끼는거지
0,헌재 대비용 변명하시네요.
0,거지 새 ㄲㅣ들땜에 엄한사람이 피해본다
0,그러니 조센징 소릴 듣지..
0, 하면 한번도 본적 없다고 할 년이야!!!
0,에휴 보기만해도 어이가 없고 화만난다
0,사람이냐?
0,라면값 씨o벌 올라봐야 얼마나오른다고 참내..
0,일본은 수많은 태풍과 지진등 이세상이 있는한자연 대재앙을 감수해야 하는 벌을 대대손손 받을것입니다!
0, 자랑스러워야 할 웰메이드 작품을 개차반으로 내치다니 !!!!
0,더워 쪄죽을때는 안오더니 날씨좀 괜찮아지니까 오냐 미친태풍아
0,가자 새끼 초딩이냐.
0, 그리고 이런 불법적인 행위들을 얼마나 태연하고 일상적으로 아무렇지 않게 해왔으면..
0,다음 형사처벌 해라
0,평창올림픽유치왜했냐 가진사람 땅투기하려고 추진한것아니냐!!!!
0, 시장이 공정하게 잘 돌어가는게 시장경제다 이 멍충들아
0,이틀동안 잠을 안재운다는건데 그자체가 폭압적 인권유린이다.
0,머리털을 다 쥐어뜯어버리고싶다
0,이것들이 또 설치네 선거때도 극 설치더니 이런 괴물 대통령도 지네 보스라고 반대처 누르고
0, 피디 어머니 최순실이냐??
0, 아휴 울화통터지져...
0, 지금 국민들 한테 대놓고 협박질 하는거냐
0,지금 저분들의 처우가 타당한지를...
0,걷거나 뛰면서 가면 경치라도 구경하고 진짜 운동이라도 되지.
0, 쓰레기들아.
0, 이쓰레기들이없어지지않는이상 진정한대한민국에독립은없다
0, 나머지 10조는 현 야당권이 다 해먹었다던데!!!
0,5.8보다 큰지진은 안온다고 장담을 하던데..........
0, 우리나라대기업..모두 망해야한다.
0, 나머지는 주둥이 닫고 묵념해라
0,쓰레기 모가지를 다 뽑아버리고 싶다!
0,저런 청문회를 내가 보고있었다니 분하다분해!
0, 장깨에 목걸지마라.
0, 닭은 범죄자다 !!!!!!!......
0, 그냥 무시를 해야 했대니깐!
0,니들20들은 취업위해 뭘하는데 5060탓으로 책임회피질이냐?
0,반성과 노력보단 남까는 정부나 기자나 국민이나!
0,미친 대머리 색기
0, 좀비 판사 새퀴야!
0, 저런 독한 여자는 화장해도 악은 감춰지지 않는다
0,그런데 솔직히 그건 아닌거 지들이 더 잘알고 있지!!
0, 세월호때 머리하고 비아그라만 생각하면.혈압오른다니까더러운 ....
0, 그후에 이젠 미국똥꼬빨고잇고.
0, 올 단두대!!!!!
0, 되도않는 인신공양 얘기하지마시고 무슨 진실을 찾는건지 제대로 좀 알고싶네.
0,세번다시 저질스러운 지도자를 잘못 뽑아서 나라를 혼란시키지 맙시다
0, 어차피 아무것고 기억안나고 모를거면서
0,이젠 호구라 불릴만큼 순하디 순한 대한민국 국민에 딱 걸렸죠.
0, 외교는 깡다구와 입으로 하는게 아니다..
0, 기상청 물갈이 해야합니다!
0,걸리면 판매자 사형시키면 된다.
0,대체 몇번째야??
0, 이게말이되냐?
0, 니 자식이 그런 일을 당했다 생각해봐라
0, 무기징역 사형 전재산환수 이게 안됨.
0,단종? 어이가 없네.
0, 근데 엉망진창 외교에 군납비리..
0, 연금을 빼앗아 처벌하라
0,태반갈아서 만병통치약이라고 한국에 수출한다던데..
0,이제 영국 침몰만이 남았다!
0,미친 사람을 대통령이라고 믿고있었더니...
0,우리나라 인간이 너무 많다
0,헬조선..
0, 하구 한날 연예인 비리 ...
0, 경찰청장을 겁박하고.
0, 돈을 받았으면!!!
0, 잘난것도 없으면서 잘난척하는거 못봐주겠다
0, 정신병자돌은년박근혜!
0,김정은이 측근들 총살하듯 고사총으로 살점하나 않남기고 국민의 이름으로 처형하자~~
0,왜 새해부터 기분 잡치게 만드냐 닭년아
0, 지금이라도 극형에처해야한다
0,김성근 정말 씹어서 버리고 싶다
0, 얘들이 차가운 물에서 죽어갈때꼭 밝혀야 된다
0,주둥이를 확 다 꿰메버리고 싶네
0,촛불이 원하는건 야당만 존재하는 대한민국??
0, 그러면 애미 둘이서 남김없이 불거다.
0,그냥 아무것도 하지마라!
0,눈이 있도 귀가 있으면 제대로 된 대답을 해라 !!!!
0,발사체 하나 만드는데 연구비용 얼마나 드는지 알고 까대냐?
0, 독재와 오만 비리와 독선.
0,뭐 패듯이 패 버려야 한다
0,저런 캐숑키가
0,댓글 알바들이냐??
0,뭘기대하누 대한민국
0,정치든 언론이든 이제 세상은 국민의 뜻으로 움직입니다.
0,이쯤되면 다른멤버들도 나간다해라.
0,니넨 앞으로 '안양'자 앞에 붙이지마라.
0,사드배치는 그 정점에 서있고..
0,ㅋㅋ진짜.돌아가는 꼴 보아하니 라도는 배역의 땅이라는 말이 진짜 맞다
0,누가 뒤질지부터 계산하고잇네
0,니그들 마지막 한 수가 계엄령 때리고 어는 지방 하나 족치것지 어딜까?
0, 나라 망하는 소리가 천지를 울리는 구나!
0,노무현대통령님 탄핵하려고 날치던 당신들이 .
0,탄핵부결은 너희들의 심판이 될 것임을 꼭 인지해라!
0, 욕나올라카네?
0, 최순실없는 최순실청문회만들어놓고 xx가튼게
0,지하철 부정승차자!!
0,얼른 처형해라~
0, 이건 교육이 아니라 해악인 것이다.
0,출입문 점등 불량이 대체 기관사 탓이냐?
0, 이 개 잡 박사모 들아.
0, 쑈그만 하고 정유라 잡아들여라
0,김치된장년들은 이땅에서 추방해야 한다.
0, 산자부 너희들 좀 정신 차려!!
0,강력하게 대응해라!!!
0,불륜 자~알 만나고 있답니다ㅋㅋㅋ
0,옥시도 퇴출시키라.
0,특검조사받겠다고 했잖아!
0, 진짜보수라면 위안안부문제와 한일군사협정등 반대시위부터 해야지 않는가
0, 여기에 발담근 놈들이 한둘 이겠냐!!!!!
0,당신은 피눈물 나는걸 이제야 느껴나요?
0,경찰이 지켜야할건 저 악마가 아니라 국민이다!!
0, 반드시 중단되어야합니다.
0,머리는 폼으로 달고 다니냐
0, 기자 새끼들도 쓸기사가 없으니 소설 쓰고 있어.
0,대한민국 국민이라도 결코 찬성하지 않을것이다
0, 특검해야하는거아냐?
0, 그냥 땅파서 뭍어버리고 싶다.ㅠ
0,슈틸리케형 소리아는 또뭔 개소리야
0,박근혜부터 끌어내리자 ㅋㅋ
0,폭력혁명이 답이다
0,아직 예약한거 못받은 사람도 있냐;;
0, 남의나라 일이 결코아닙니다 !!
0, 끈적끈적한데 덥다고만 하네 에휴
0, 그럼 강정호 이대호 박지성 다 욕해야지..
0,도마 안쓰고 가위로 자르고 쓴다.됫냐?
0,이 무당 새끼들 자살은 안돼
0, 장난쳐?
0,그래서개누리당괴멸시키세요
0,드디어 임계점이 다가오고 있다
0,최경위 등 이정권 하에서 죽은 사람의 인권은...?
0,정성룡말고 김승규 넣으라고 아인맥축구진짜
0, 내새끼 제대혈을 저딴 새끼들이 사용했다니...
0,옛날처럼 주리라도 틀고싶다.
0,이완영 애는 국회의원도아냐
0,근데 서로 헐뜯으면 부모님 만수무강하시고 니들 하는일 잘되고 그러냐???
0, 한화팀은 확실히 잡고가야 안되겠나?
0,국정원은 이런시국에 아직도 댓글알바 하네 ㅡㅡ
0, 중국은 그에비하면 양반격이지.
0,펠라이니 조져야한다
0,공범 증명하냐??
0, 내가보기엔 당신은 위선자..
0,위증죄 삼대를 공직에 못올리고 연좌제를 실시하시오
0,저놈들은김정은보다더악마야..
0,와 진짜 이중성대단...
0, 안 챙피하냐?
0,뭣도 모르고 사람이 바뀌었단다 ㅋㅋㅋㅋ
0,이번에도 비올지 안올지 지겨봐야 한다
0,국민의당 안철수는 처음부터 박근혜의 즉각퇴진 또는 탄핵을 외쳤다 .
0,화가 나네요
0,교육부 장관 외교부 장관 문체부 장관 이것들이 하는 짓들은 왜 이렇게 한심한건지... 툇
0,역시나 알고도 모르쇠 도망간거네.
0, 저렇게 하면 안돼.
0,서해 수자원도 한류라서 그동안 불법조업 방치했나?
0,어깨라도넓엇으면 옷빨이라도 잘살텐데..
0, 그저 보고싶어죽겟어요
0,아 진짜 저한테는 악운만 붙는거같네요ㅠㅠ........0
0, 지금 계단에서울고있어요
0,저때문에 택배하나 배달하려다 변을 당하신건 아니겠죠0
0,잊은줄 알았는데 잊을수 있다고 생각 했는데갑자기 쏟아지는눈물에  강남한복판에서 주저앉게 되더라..
0,거의 처음 연애였고 처음엔 그 사람이 시작했지만 마지막엔 저만 질질 끌려다니는 연애였네요.
0,근데 같이 갈 사람이 없다는게 안타깝네요..ㅜㅜ
0,어떻게 해야 제 성별을 안착각하게 할수있을까요?
0,유일하게 남은게 그분 내의나 냉장고에 붙혀진 시 한 편이 고작입니다.
0,초딩인데요좋아하는 아이를 그만 접으려고요
0,3년만에 차였어요..
0,남친이 이번달말에 입대하는데 ㅠㅠ
0, 정년까지 버텨야 하는데 정보가 없네요
0,내년에 34살이 됩니다
0,저희집은 성인이 훌쩍 넘었지만 외박 절대 안되는 집입니다 ㅠ
0,매일 밤마다 왜 오늘은 고작 이정도밖에 공부하지못했나 하는생각이든다...
0,콧망울이 너무 못생겼어 ㅜㅜ
0,너무 슬프고 세상을 다 잃은 기분이고...
0, 모쏠인데 어떻게 하면 연애할수있냐ㅠㅠ
0,그 눈빛을 난 잊을 수가 없어 오래됬는데...
0,제여친은 절 좋아하는거 같지않고...
0,혼자 떨어져있는 느낌이 들어서 활발하게 대하고 놀고싶은데 그게안되요ㅠ
0,앞으로도 너같은 사람 못만날거같다.
0,저는 아직까지 한통의 전화와 편지가 오지 않았네요ㅠ
0,우린 엇갈릴수밖에 없는걸까..
0,그리고 그럴 수 없음에 너무 속상해하고 우울해하며 하루하루를 보내고 있어요.
0,너한테 그렇게 매달렸는데 넌 싫다고했어
0,흑 남친도 없구 회사는 너무 바쁘구..
0,지금 생각하면너무나 가슴이 아파요...
0, 오라버니 마음이 아플것 같아서 저의 마음이 더 아프네요...
0,"  부상과 열악한 연습환경, 온 국민의 기대의 부담감을 안고 얼마나 힘들었을까요..."
0, 런닝맨 오늘 안해서 너무 슬퍼요 ㅠㅠ
0, 에휴 아직두 화요일이라니..ㅠㅠ
0,야구의 전설중의전설 최동원님께서암투병중에 별세하심에 애도를표합니다.
0,사실 무도에서 컴백이 힘들거라는 말 듣고 많이 슬펐어요 ㅜㅜ
0,저도 삶의 노력과 희망이였는데 솔직히 점점잊혀지는거 같아서....
0,세상에 마음 둘곳이 없다.
0,58까지 최하로 빼봤는데 별로 달라지는 거 모르겠음 ㅠㅠㅠ
0,환승이별 당한지 한달이 넘은 여자입니다.
0, 곰신분들 저는 어쩌면 좋을까여?ㅜㅜ
0,위로좀 해주세요
0, 하루에도 몇번씩 추억에 심장이 쿵하고 내려앉고 어느 특정한 날짜만 나와도 아 이때는 내가 너랑 헤어지기 전이였네 후였네로 나뉜다.
0,예전에 서로 좋아했는데 그땐 서로 몰랐고 결국 잘안됐는데 걔가 날 좋아한걸 지금 알게됐어
0,누군가를 좋아한다는게 이렇게 힘든건지 예전엔 미처 알지 못했다
0,저 이제 어케 살아가야 함?..
0, 뭐 좋다는 남자도 없는데그냥 다 내려놓고 살까봐요 ㅠㅠ서글프다......
0,바로 취업이 될줄알았는데 어렵네요
0, 근데 그 사건이 계속 생각이나서 미치겠어요
0,열흘전 전여친에게 이별통보 받았습니다.
0,난 언제쯤 괜찮아질까
0,그냥 내속에서 아름답게 머무르지 왜 연락은 해서 우스워져…
0, 저희 엄마도 동생을 못보게 하네요.
0,전전남친과 헤어졌을때 정말 죽을만큼 힘들었어요.
0,떨어져서 기분이 너무속상해요...
0,요즘 몸도 아프고 돈나갈때도 많아지고안그래도 힘든데 날씨까지 추워지니 지치네요
0, 부모님이사이가안좋아서 따로삽니다..
0,중년이 되어 한숨만 나옵니다
0,친구들에게 남친 아이갖고 싶다니까 미쳤대요
0,하체만 보면 진짜 한 60은 될 거 같아 어떻게 빼야 할까 ㅠㅠㅠ
0, 모든걸 허무로 돌릴 수 있을만큼 부질없더라.
0, 동창회에도 안부르고 왕따는 아니였는데..
0,미래를 본다면 제가 훨씬 나을수도 있지만 현재로썬 정말 힘드네요..
0, 걱정이 많이 되네요
0,일주일전 어머니가 심근경색으로 돌아가셨어요.
0,제 운도 여기까지 인듯ㅠㅠ
0, 사랑받고싶고 가끔은 정말 외로워서 혼자 울기도해요.
0, 더이상 연락 안하고 싶어지면 좋겠다..
0,하 우울한주말이네요
0,난 연애 못할거야..
0,헤어진지 한달 조금 넘었는데나아질 기미가 보이지 않아요
0,맨날 혼자보러 다녀요 ㅠㅠㅠ
0, 너무 비참해서 눈물나네
0,사실 제가 좀 못생겨서 예전에 소개팅때도 많이퇴짜 먹은편인데이제 좀 벗어나고 싶어요 ㅜㅜ
0,아놔~인생이 암울하다ㅠ
0,이 여자아니면 다시는 여자친구 못만날꺼 같습니다.
0,예쁜 눈으로 봐주셨으면 하는데 그게 아니라 많이 속상할뿐이네요~
0,나는 항상 버림 받는 존재
0, 죽고싶다 라는 생각 이 듭니다.
0,제 맘이 너무아프거든요
0,  언제나 주말은 빨리 지나가는 느낌이예요..
0,자영업으로만 할 수 밖에.없는 현실...
0, 서민 언제 탈출하려나?ㅜㅜ
0,도깨비가 이제 끝나는구나 ㅠㅠ
0,세상이 살기 힘드니 혼자 살아가는 사람이 늘어난다
0,명절에 저렇게 내려갈 고향이 있어서 좋겠다….
0,서비스직은 임시공휴일에도 빨간날에도 다일한다
0,요즘 참 먹고살기 힘들다니깐.....
0,나이가 왜이리 들어 보이는건지...ㅠㅠ
0,잘못도 없는데 왜 자꾸 죄인취급하는지
0,주가가 곤두박질 치고있어요ㅜㅜ
0,3회밖에 안남았다니 ㅠㅠ
0,아이를 이 무서운 세상에 태어나게 해도 되나 싶네요ㅜㅠ
0,광화문 4시부터 9시까지 시위하다가 이제 집가는데 힘듬 ㅠㅠ
0,늙음의 서러움이란
0,혼자서 먹고있다...
0,이제 이세상 살기 힘들어지는구나
0,미래가 없네....
0,먹고 살기도 바쁜데 결혼은 할수 있을까?
0,생각만 해도 벌써 가슴이 먹먹하다
0,한우 비싸서... 티비서 눈으로만 먹습니다. ㅠ
0,통장에 500만원도 없다
0,이제 볼만한 예능없어졌다ㅜㅜ
0,이제 뭔 재미로 살아야하나...ㅠㅠ
0,인생 참 덧없네요.....ㅜㅜ...
0,한국사람이 저짓을 하고있다는게 맘이더아프다
0,거기서는 정말 행복하길 바랍니다…ㅠㅠ
0,형제가 아파하고 있도다ㅠㅠ
0,구구절절 눈물이 날것만같다..
0,한혜진 보는 재미도 쏠쏠했는데 아쉽네
0,세상이 온통 사기꾼 소굴이니 누구말이 옳은지 틀린지 알수가 없네. ㅠㅠ
0,살처분 당하는 새들이 너무 불쌍해..
0,참 아쉽네...세월이 보통 세월이 아닌데.
0,이렇게 보면 우리나라는 진짜 힘이 없는 약소국이네요 ....
0,정말 왜이러는걸까요~~~~~침울하다..
0,나도 밥이안넘어가더라..
0,울고 싶게 가슴이 막막하다.
0,이번 무도는 그냥 도산안창호 선생님 얘기를 알아가며 솔직히 그냥 그러러니 보고잇는데 막내아들안필영 선생님께서 기억해주세요라는 말에 갑자기 감정이 북받혀 눈물이 나더라...
0,우주를 보면 지구는 먼지에 불과하고 그안의 인간은 아무것도 아닌존재구나
0,친일파 정리가 안됐기때문에 이런일이 생긴다.
0,끌고간 악어의 뱃속을 갈라 야지 ...아 끔찍한 사고다 .... 가여워
0,무슨 매일 한파냐....겨울이지만 좀 따듯하게보내고싶다ㅠ
0,정말..무도에서 유관순 얘기나왔을때..뭉클하고..죄송스럽더라...
0,여자가 참 안타깝다.
0,끝나는게 넘 아쉽다..ㅠㅠ
0,어린 선수들 잘 지도해주셨는데....좋은 지도자 한분을잃은 한국축구의슬픈날이네요
0,일년정도 쓰면 고장나...
0, 세월이 유수와도 같구나...ㅠㅠ
0, 그곳은 평안한지요..
0,한 마리의 반려견을 키우는 사람의 입장으로 보니 저렇게 사고 팔리는 동물들이 불쌍하고 안타깝기만 합니다.
0,코끼리에게 너무 미안하네요
0,맘고생이 얼마나컸을까요
0, 난 비싼 휴대폰 구매할 여력이 안되네...
0,아침부터 정말 속상한 기사네요.
0, 마지막은 늘 아쉽고 또 아쉽다.
0,아.... 제발 살아있으시길 바랬는데....
0, 이제 이런희생이 없기를....
0,자영업 고마 하라는 거지..
0,잠을 못자서 스트레스가 장난 아님...ㅠㅠ
0, 서민들은 어떻게 살라고 계속 오르는지..
0,세월호는 세월이 얼마나 지나든지 우리 나라가 멸망할때까지 잊혀지면 안되는 사건들 중 하나이다.
0,유산소 지겨워서 하기싫은데 어떡하죠?ㅠㅠ
0,넌 나 보고 싶지도 않나봐..
0,저도 이렇게 못잊는제가 한심하네요
0, 다리를 심하게좀 다쳤어요
0,학업으로 인해 갑작스러운 이별통보를 받았습니다.
0, 이제 쪼금의 희망 가지고 살던 하루하루도 끝이네요
0, 친구들한테 오늘 데이트한다고 다 말해놧는데 진짜 하루종일 집에만 있는 제가 너무너무 비참해요
0, 저 혼자 권태기인 것 같은데참 답답하네요
0,저 직장생활한지 두달되었는데 저 짤렸어요
0,이렇게 올해도 가네..
0,지금 스마트폰 잃어버려서 카톡이 안돼요ㅠㅠ
0,머리로는 알겠는데 가슴은 찢어질듯
0,여름 휴가도 못가보고..
0,이제 변하지 않는 너의프로필만 멍하니
0, 내일도 보기로 했는데 얼굴도 못볼거 같아요...
0,난오늘도일한다 ㅠ
0,창피스럽다.
0,"돌겠네.과충전 상태면 폭발 가능.잘때 충전 시켜놓고 밤새 충전하면 과충전은 당연한 건데,이젠 알람 켜놓고 충전 시간까지 체크해야 하나"
0,박근혜 추종자는 잠재적 범죄자임
0,이거걸려서 아파서 걷지도 못함..
0,간절히 원하면 전우주가 나서서 도와주나요
0,아.. 창피해 ㅠㅠ앞으로 sns 하지마세요 !!
0,내가 이럴려고 댓글달았나... 자괴감이드네요...
0,자고십다..푹.....
0, 이제 탄핵 말고는 없죠.
0,국민들너무힘들다
0, 의경도 힘듭니다
0, 뭐가 뭔지 이제 헷갈릴정도다
0,지금 너네가 문제가 아니야......
0,시댁이고친정이고 돈나가는거보면 다음달이 무섭다
0,비 언제 오는건데....
0,개키우는게 이렇게 힘듭니다
0,난 초ㅓ저시급에 허덕이고......
0,요즘 돈없으면 서울대 못간다...
0, 1위함찍었으면 됐다.겐히 부담간다.
0, 노인부양이 어렵다....
0,근데 한국에서 아무리 성공해도 노비일 뿐이다..
0,여성으로서 사생활이 이런거였나?
0,살아있는게 지옥인데?
0, 너무 힘들어서 공무원을 생각하는 사람이에요...
0, 생리통도 점점 심해지고..
0,시키면 돈이아까울것같고치킨은 먹고싶고.
0,저보고 꺼지라고 꼴도보기싫다고 정이다떨어졌다네요..
0, 사람 심성도괜찮고누굴선택해야할까
0,살이 빠질 생각을 안하네요 ㅠㅠㅠㅠㅠㅠㅠ
0, 이문제 어찌해결해안될까요? 휴
0, (엑박 살돈 까진 있음;;)도와주세요 Help me ㅠㅜ0
0,오늘로 차인지 사흘째네요.
0,술은 어째 마시면 마실 수록 못 끊을까요...
0,그래도 이게 옳다고 봐힘들지만......하하ㅎㅎ
0, 깐 콩까지나 안 깐 콩깍지나 콩깍지는 다 콩깍지인데너무 어렵네요
0,계속집에만있게되요
0, 앞베란다 뒷베란다로 다 집어던지구요..
0,이제 저는 죽고 싶습니다...
0, 이것때매 미치것서요ㅠㅠㅠㅠ
0,아파트18층까지걸어올라갈려구요ㅠ
0,죽을꺼같아요..
0,아~어떡하면좋죠???큰일이네......
0,정말 힘드네요...
0,원래친한 오빠동생 사이였는데 다시 그때처럼 연락하며 지내는게 맞는걸까요..
0,제발 그만 생각 났으면 좋겠어요
0,아 고민이네여 ㅠㅠ0
0, 이제 와서 공무원 시험이라니...어떻게 생각하시나요ㅠㅠ
0,운동을 하루에 2시간씩 꾸준히해서 걱정은안되는데식단관리가정말 안되네요
0,왜일까... 왜 밤에는 잠이 안올까
0,오아시스노래를 하루중 12시간을 듣고있어서귀가너무아퍼요 ㅠㅠㅠㅠㅠㅠ0
0,여자친구 없는게 이해가 안되네요0
0,아니 사람사는 데인데 장마때마다 여기 엄청 고생해요 ㅠㅠ
0,계속 풀어도 계속 나옴 잠 못 잠 ㅇㅇ
0, 여자는 정말 너무어려워요..
0,8기가에 다넣을순없고 ㅠㅠ
0,"위험성 충분히알았고, 괴롭다,"
0,그당시 놀라서 몰랐는데 지금 허리가 너무 아파요 ㅠ
0,아파트 층간소음때문에 고민입니다
0,다른건 몰라도 대야썰매가 넘 힘들었답니다.
0,물론 책임자인 저의 잘못이 큽니다.
0, 저도 공부에 올인하고싶은데 아버지를 설득하기가 쉽지않을듯합니다.
0, 숨이 부족하다고 해야하나 아무튼 숨쉬는게 힘들어 ..
0,중요한 시험을 앞두고 있는데 무슨 방법이 없을까요??
0,친구들하고 싸운것도 일절없는데...
